<?xml encoding="UTF-8"?>

<!ELEMENT konyvek (konyv*)>

<!ELEMENT konyv (cim, kiadasi_ev, kiado, szerzo+)>
<!ATTLIST konyv id CDATA #REQUIRED>

<!ELEMENT kiadasi_ev (#PCDATA)>
<!ELEMENT cim (#PCDATA)>
<!ELEMENT kiado (#PCDATA)>
<!ELEMENT szerzo (#PCDATA)>
